,Chuẩn hoá tên
1333,CÔNG TY CỔ PHẦN ĐẦU TƯ ĐẠI DƯƠNG THĂNG LONG
1334,CÔNG TY CỔ PHẦN PHÁT TRIỂN TÀI NGUYÊN THIÊN NHIÊN ĐẠI DƯƠNG
1335,CÔNG TY CỔ PHẦN KHÁCH SẠN VÀ DỊCH VỤ OCH
1336,CÔNG TY CỔ PHẦN FAFIM VIỆT NAM
1337,CÔNG TY TNHH LOGISTICS VINALINK (CAMBODIA)
1338,CÔNG TY CỔ PHẦN THƯƠNG MẠI ĐẦU TƯ PHÁT TRIỂN ĐẠI TÂY DƯƠNG PHÚ QUỐC
1339,CÔNG TY CỔ PHẦN XUẤT NHẬP KHẨU VẬT TƯ NÔNG NGHIỆP III
1340,CÔNG TY TNHH MỘT THÀNH VIÊN ĐIỆN TỬ ĐIỆN QUANG
1341,CÔNG TY TNHH MỘT THÀNH VIÊN CÔNG NGHỆ CAO ĐIỆN QUANG (DQH)
1342,CÔNG TY TNHH THƯƠNG MẠI DỊCH VỤ ĐIỆN QUANG
1343,CÔNG TY CỔ PHẦN ĐẦU TƯ VÀ XÂY LẮP ĐIỆN QUANG
1344,CÔNG TY TNHH MỘT THÀNH VIÊN DƯỢC PHẨM OPC BÌNH DƯƠNG
1345,CÔNG TY CỔ PHẦN DƯỢC PHẨM TRUNG ƯƠNG 25
1346,CÔNG TY CỔ PHẦN ĐẦU TƯ VÀ PHÁT TRIỂN KỸ THUẬT NAGAKAWA
1347,CÔNG TY CỔ PHẦN NAGAKAWA ĐÀ NẴNG
1348,CÔNG TY CỔ PHẦN NAGAKAWA THÀNH PHỐ HCM
1349,CÔNG TY CỔ PHẦN ĐIỆN TỬ NAGAKAWA
1350,CÔNG TY CỔ PHẦN PHÁT TRIỂN SIÊU THỊ HÀ NỘI
1351,CÔNG TY CỔ PHẦN ĐẦU TƯ THƯƠNG MẠI HAPRO ĐÀ NẴNG
1352,CÔNG TY CỔ PHẦN ĐẦU TƯ THƯƠNG MẠI VÀ DỊCH VỤ CHỢ BƯỞI.
1353,CÔNG TY CỔ PHẦN RƯỢU HAPRO
1354,CÔNG TY THƯƠNG MẠI DỊCH VỤ TRÀNG THI
1355,CÔNG TY CỔ PHẦN XUẤT NHẬP KHẨU TCMN VÀ DU LỊCH THƯƠNG NHÂN HAPRO
1356,CÔNG TY CỔ PHẦN THUỶ TẠ
1357,CÔNG TY CỔ PHẦN SỰ KIỆN VÀ ẨM THỰC HAPRO
1358,CÔNG TY CỔ PHẦN GỐM CHU ĐẬU
1359,CÔNG TY CỔ PHẦN CÔNG NGHỆ HPT
1360,CÔNG TY CỔ PHẦN PHÁT TRIỂN Y HỌC AN VIỆT
1361,CÔNG TY CỔ PHẦN CRYSTAL HOLIDAYS
1362,CÔNG TY CỔ PHẦN EVERLAND VÂN ĐỒN
1363,CÔNG TY CỔ PHẦN EVERLAND PHÚ YÊN
1364,CÔNG TY CỔ PHẦN THỰC PHẨM HÀ NỘI
1365,CÔNG TY TNHH VIETCOMBANK-BONDAY-BEN THANH
1366,CÔNG TY LIÊN DOANH QUẢN LÝ QUỸ ĐẦU TƯ CHỨNG KHOÁN VIETCOMBANK
1367,CÔNG TY TNHH BẢO HIỂM NHÂN THỌ VIETCOMBANK-CARDIFF
1368,CÔNG TY LIÊN DOANH VIETCOMBANK - BONDAY
1369,CÔNG TY TNHH CASTROL BP-PETCO VIỆT NAM
1370,CÔNG TY CỔ PHẦN THỨC ĂN CHĂN NUÔI VIỆT THẮNG
1371,CÔNG TY LIÊN DOANH THÁP BIDỊCH VỤ
1372,NGÂN HÀNG LIÊN DOANH VIỆT – NGA
1373,CÔNG TY TNHH LƯƠNG THỰC CAMPUCHIA - VIỆT NAM (CAVIFOODS)
1374,CÔNG TY TNHH BẢO HIỂM NHÂN THỌ BIDỊCH VỤ METLIFE
1375,CÔNG TY CỔ PHẦN CHO THUÊ MÁY BAY VIỆT NAM (VALC)
1376,CÔNG TY CỔ PHẦN GIỐNG VẬT NUÔI HÀ NỘI
1377,CÔNG TY CỔ PHẦN IN SÁCH VIỆT NAM
1378,NGÂN HÀNG THƯƠNG MẠI CỔ PHẦN KỸ THƯƠNG VIỆT NAM (TECHCOMBANK)
1379,CÔNG TY CỔ PHẦN ĐẦU TƯ SCIC – BẢO VIỆT (BẢO VIỆT SCIC)
1380,NGÂN HÀNG THƯƠNG MẠI CỔ PHẦN BẢO VIỆT
1381,CÔNG TY CỔ PHẦN TRUNG NAM PHÚ QUỐC
1382,CÔNG TY LIÊN DOANH BẢO HIỂM BẢO VIỆT - TOKIO MARINE
1383,CÔNG TY CỔ PHẦN DU LỊCH PHÚ QUỐC
1384,CÔNG TY CỔ PHẦN ĐẦU TƯ VÀ XÂY DỰNG LONG VIỆT (LONG VIỆT)
1385,CÔNG TY CỔ PHẦN CÔNG NGHỆ THÔNG TIN PLT
1386,CÔNG TY TNHH KHÍ NHIÊN LIỆU GIAO THÔNG VẬN TẢI PVGAZPROM
1387,CÔNG TY CỔ PHẦN CHẾ BIẾN DỪA Á CHÂU
1388,CÔNG TY TNHH MIRAKA
1389,CÔNG TY CỔ PHẦN APIS
1390,TỔNG CÔNG TY CỔ PHẦN BẢO HIỂM BẢO LONG 
1391,CÔNG TY CỔ PHẦN SÀI GÒN KIM LIÊN
1392,CÔNG TY CỔ PHẦN DU LỊCH KHÁCH SẠN SÀI GÒN - HẠ LONG
1393,CÔNG TY CỔ PHẦN THÔNG TIN TÍN DỤNG VIỆT NAM
1394,CÔNG TY CỔ PHẦN DU LỊCH SÀI GÒN - QUY NHƠN
1395,CÔNG TY CỔ PHẦN DỊCH VỤ THẺ SMARTLINK
1396,CÔNG TY CỔ PHẦN CHỨNG KHOÁN TÂN VIỆT
1397,CÔNG TY CỔ PHẦN ĐẦU TƯ PHÁT TRIỂN NHÀ ĐÀ NẴNG  
1398,CÔNG TY CỔ PHẦN DÂY CÁP ĐIỆN VIỆT THÁI
1399,CÔNG TY CỔ PHẦN XUÂT NHẬP KHẨU HÀNG KHÔNG (AIRIMEX)
1400,CÔNG TY CỔ PHẦN NHỰA CAO CẤP HÀNG KHÔNG (APLACO)
1401,CÔNG TY CỔ PHẦN ĐẦU TƯ MIC (MIC INVEST)
1402,CÔNG TY CỔ PHẦN LONG THUẬN LỘC
1403,TỔNG CÔNG TY CỔ PHẦN BẢO HIỂM SÀI GÒN – HÀ NỘI (BSH)
1404,CÔNG TY CỔ PHẦN CHỨNG KHOÁN SÀI GÒN HÀ NỘI
1405,CÔNG TY CỔ PHẦN SYNNEX FPT
1406,CÔNG TY CỔ PHẦN BÁN LẺ KỸ THUẬT SỐ FPT
1407,CÔNG TY CỔ PHẦN CÔNG NGHỆ HOMA
1408,CÔNG TY CỔ PHẦN QUẢN LÝ QUỸ ĐẦU TƯ FPT
1409,CÔNG TY CỔ PHẦN CHỨNG KHOÁN FPT
1410,CÔNG TY CỔ PHẦN HOA SEN QUY NHƠN
1411,CÔNG TY CỔ PHẦN ĐẦU TƯ HẠ TẦNG KHU CÔNG NGHIỆP HOA SEN DU LONG
1412,CÔNG TY CỔ PHẦN NĂNG LƯỢNG SÔNG HỒNG
1413,CÔNG TY CỔ PHẦN THỦY ĐIỆN NẬM CHIẾN (SƠN LA)
1414,CÔNG TY CỔ PHẦN MÁY THIẾT BỊ DẦU KHÍ MIỀN BẮC VIỆT NAM
1415,CÔNG TY CỔ PHẦN THỰC PHẨM CHOLIMEX
1416,CÔNG TY CỔ PHẦN CHỈ SỢI CAO SU VRG SA DO
1417,NHÀ GA QUỐC TẾ CAM RANH
1418,THAI VIETJET AIR JOINT STOCK COMPANY LIMITED
1419,VIETNAM OFFSHORE FLOATING TERMINAL (RUBY) LIMITED
1420,MALAYSIA VIETNAM OFFSHORE TERMINAL LIMITED
1421,"CÔNG TY LIÊN DOANH RONGDOI MV12 PTE.,LTD (SINGAPORE)"
1422,CÔNG TY CỔ PHẦN CHẾ TẠO GIÀN KHOAN DẦU KHÍ
1423,CÔNG TY CỔ PHẦN GỖ MDF VRG DONGWHA
1424,CÔNG TY CỔ PHẦN CAO SU BẾN THÀNH
1425,CÔNG TY CỔ PHẦN XÂY DỰNG VÀ TƯ VẤN ĐẦU TƯ
1426,CÔNG TY CỔ PHẦN KINH DOANH BOT DT 741
1427,CÔNG TY TNHH THƯƠNG MẠI VÀ NHÂN LỰC QUỐC TẾ FLC
1428,CÔNG TY CỔ PHẦN KỸ THUẬT HÀNG KHÔNG SAO MAI
1429,CÔNG TY TNHH S.A.S - CÔNG TYAMAD
1430,CÔNG TY CỔ PHẦN ĐẦU TƯ KHU CÔNG NGHIỆP DẦU KHÍ LONG SƠN
1431,TỔNG CÔNG TY THIẾT BỊ ĐIỆN ĐÔNG ANH - CÔNG TY CỔ PHẦN
1432,CÔNG TY CỔ PHẦN THỐNG NHẤT
1433,CÔNG TY CỔ PHẦN PHÁT TRIỂN NÔNG NGHIỆP VIỆT MỸ - HÀ TĨNH
1434,CÔNG TY CỔ PHẦN XÂY DỰNG CAO SU ĐỒNG NAI
1435,CÔNG TY CỔ PHẦN KHU CÔNG NGHIỆP HỐ NAI
1436,CÔNG TY CỔ PHẦN CHẾ BIẾN GỖ CAO SU CHƯ PĂH
1437,CÔNG TY CỔ PHẦN DU LỊCH CAO SU HÀM RỒNG
1438,CÔNG TY CỔ PHẦN LỘC THỊNH
1439,CÔNG TY CỔ PHẦN ĐẦU TƯ VÀ PHÁT TRIỂN VRG LONG THÀNH
1440,CÔNG TY CỔ PHẦN  Ô TÔ SAO TÂY NAM (HYUNDAI TÂY ĐÔ)
1441,CÔNG TY CỔ PHẦN ĐẦU TƯ SAVICO
1442,CÔNG TY LIÊN DOANH COMFORTDELGRO SAVICO TAXI
1443,CÔNG TY TNHH TOYOTA LÝ THƯỜNG KIỆT
1444,CÔNG TY CỔ PHẦN ÔTÔ BẮC ÂU
1445,CÔNG TY CỔ PHẦN DỊCH VỤ Ô TÔ THÀNH PHỐ MỚI BÌNH DƯƠNG
1446,CÔNG TY CỔ PHẦN TOYOTA ĐÔNG SÀI GÒN (TESC)
1447,CÔNG TY CỔ PHẦN ĐẦU TƯ XÂY DỰNG CƠ SỞ HẠ TẦNG BÌNH PHƯỚC
1448,CÔNG TY CỔ PHẦN ĐẦU TƯ XÂY DỰNG CAO SU
1449,CÔNG TY TNHH NGHIÊN CỨU KHOA HỌC & SẢN XUẤTTN CAO SU VISORUTEX
1450,CÔNG TY CỔ PHẦN CAO SU TP HỒ CHÍ MINH
1451,CÔNG TY TNHH PHÚ VIỆT TÍN
1452,CÔNG TY TNHH ĐÔ THỊ VÀ CÔNG NGHIỆP NAM TÂN UYÊN
1453,CÔNG TY TNHH LIÊN DOANH ỐNG THÉP SENDO
1454,CÔNG TY TNHH SMC - SUMMIT
1455,CÔNG TY TNHH SMC - TOAMI
1456,CÔNG TY CỔ PHẦN ĐẦU TƯ SÀI GÒN VRG
1457,CÔNG TY TNHH DỊCH VỤ KỸ THUẬT NUÔI TRỒNG THỦY SẢN MINH PHÚ AQUAMEKONG
1458,CÔNG TY CỔ PHẦNXÃ HỘI CHUỖI TÔM RỪNG MINH PHÚ
1459,CÔNG TY TNHH MEKONG LOGISTIC
1460,CÔNG TY CỔ PHẦN ĐẦU TƯ HẠ TẦNG FCC
1461,CÔNG TY CỔ PHẦN THƯƠNG MẠI QUẢNG TRỌNG
1462,CÔNG TY CỔ PHẦN ĐẦU TƯ HITECCONS
1463,CÔNG TY CỔ PHẦN CÔNG NGHIỆP KHOÁNG CHẤT DMC
1464,CÔNG TY CỔ PHẦN CHỨNG KHOÁN DẦU KHÍ
1465,CÔNG TY LIÊN DOANH QUẢN LÝ QUỸ ĐẦU TƯ CHỨNG KHOÁN VIETCOMBANK
1466,TỔNG CÔNG TY VÀNG AGRIBANK VIỆT NAM - CÔNG TY CỔ PHẦN
1467,CÔNG TY TNHH BẢO HIỂM NHÂN THỌ VIETCOMBANK-CARDIFF
1468,CÔNG TY CỔ PHẦN DỊCH VỤ THẺ SMARTLINK
1469,CÔNG TY CỔ PHẦN THẠNH MỸ LỢI
1470,CÔNG TY CỔ PHẦN 234 THẠNH MỸ LỢI
1471,CÔNG TY CỔ PHẦN PHÁT TRIỂN ĐẤT VIỆT
1472,CÔNG TY CỔ PHẦN ĐIỆN TỬ VÀ DỊCH VỤ CÔNG NGHIỆP SÀI GÒN
1473,CÔNG TY CỔ PHẦN PHÁT TRIỂN VÀ DỊCH VỤ NHÀ BẾN THÀNH
1474,CÔNG TY TNHH KINH DOANH VĂN PHÒNG DẦU KHÍ BÀ RỊA - VŨNG TÀU
1475,CÔNG TY CỔ PHẦN DỊCH VỤ HÀNG KHÔNG SÂN BAY TÂN SƠN NHẤT
1476,CÔNG TY CỔ PHẦN PHỤC VỤ MẶT ĐẤT SÀI GÒN (SAGS)
1477,CÔNG TY CỔ PHẦN VẬN TẢI HÀNG KHÔNG MIỀN NAM
1478,CÔNG TY CỔ PHẦN THƯƠNG MẠI HÀNG KHÔNG MIỀN NAM
1479,CÔNG TY CỔ PHẦN PHỤC VỤ MẶT ĐẤT HÀ NỘI (HGS)
1480,CÔNG TY CỔ PHẦN DỊCH VỤ HÀNG HÓA HÀNG KHÔNG (ACS)
1481,CÔNG TY CỔ PHẦN KHỬ TRÙNG VIỆT NAM
1482,CÔNG TY TNHH MỸ PHẨM LG VINA
1483,CÔNG TY CỔ PHẦN ĐẦU TƯ PHÁT TRIỂN PHONG THỊNH
1484,CÔNG TY CỔ PHẦN XÂY DỰNG SỐ 12
1485,CÔNG TY CỔ PHẦN ĐẦU TƯ TCỔ PHẦN
1486,CÔNG TY CỔ PHẦN DỊCH VỤ HÀNG HÓA SÀI GÒN
1487,CÔNG TY CỔ PHẦN NHÀ GA QUỐC TẾ CAM RANH
1488,CÔNG TY CỔ PHẦN ĐẦU TƯ KHAI THÁC NHÀ GA HÀNH KHÁCH QUỐC TẾ ĐÀ NẴNG (AHT)
1489,CÔNG TY TÀI CHÍNH CỔ PHẦN VINACONEX-VIETTEL
1490,CÔNG TY CỔ PHẦN XI MĂNG CẨM PHẢ
1491,CÔNG TY CỔ PHẦN ĐẦU TƯ VÀ PHÁT TRIỂN NĂNG LƯỢNG VINACONEX (VINACONEX P&C)
1492,CÔNG TY TNHH QUỐC TẾ LIÊN DOANH VINACONEX TAISEI
1493,CÔNG TY CỔ PHẦN VIPACO
1494,CÔNG TY CỔ PHẦN ĐẦU TƯ BOT HÀ NỘI - BẮC GIANG
1495,CÔNG TY CỔ PHẦN BAO BÌ ĐẠM PHÚ MỸ
1496,CÔNG TY CỔ PHẦN PHÁT TRIỂN ĐÔ THỊ DẦU KHÍ
1497,CÔNG TY CỔ PHẦN HÓA DẦU VÀ XƠ SỢI DẦU KHÍ (PVTEX)
1498,CÔNG TY CỔ PHẦN BAO BÌ HABECO
1499,CÔNG TY CỔ PHẦN HAREC ĐẦU TƯ VÀ THƯƠNG MẠI
1500,CÔNG TY CỔ PHẦN VẬN TẢI HABECO
1501,CÔNG TY CỔ PHẦN BIA HÀ NỘI - KIM BÀI
1502,CÔNG TY TNHH THỦY TINH SANMIGUEL YAMAMURA HẢI PHÒNG
1503,CÔNG TY CỔ PHẦN ĐẦU TƯ PHÁT TRIỂN HABECO
1504,CÔNG TY TNHH TIẾP VẬN QUỐC TẾ ICD BIÊN HÒA
1505,CÔNG TY CỔ PHẦN CÀ PHÊ TÍN NGHĨA
1506,CÔNG TY CỔ PHẦN S CAFE
1507,CÔNG TY CỔ PHẦN CẢNG CONTAINER ĐỒNG NAI
1508,CÔNG TY CỔ PHẦN QUẢN LÝ DỰ ÁN TÍN NGHĨA
1509,CÔNG TY CỔ PHẦN THỐNG NHẤT (KHU CÔNG NGHIỆP BÀU XÉO)
1510,CÔNG TY CỔ PHẦN VẬN TẢI XĂNG DẦU TÍN NGHĨA
1511,CÔNG TY CỔ PHẦN THẨM ĐỊNH GIÁ ĐỒNG NAI
1512,CÔNG TY TNHH THƯƠNG MẠI QUỐC TẾ (QUẢNG ĐÔNG) VIÊN THỊ LỘC TRỜI
1513,CÔNG TY CỔ PHẦN LION AGREVO
1514,CÔNG TY CỔ PHẦN VINACONEX XUÂN MAI ĐÀ NẴNG
1515,QUỸ ĐẦU TƯ VIỆT NAM
1516,CÔNG TY CỔ PHẦN EVN QUỐC TẾ
1517,CÔNG TY CỔ PHẦN ĐẦU TƯ VÀ THƯƠNG MẠI VINACONEX-UPGC
1518,CÔNG TY CỔ PHẦN DẦU NHỜN STS
1519,CÔNG TY TNHH THÀNH PHỐ CÔNG NGHIỆP MỚI NHƠN TRẠCH
1520,CÔNG TY CỔ PHẦN ĐẦU TƯ VÀ PHÁT TRIỂN ĐIỆN BẮC MIỀN TRUNG
1521,CÔNG TY CỔ PHẦN NHIỆT ĐIỆN QUẢNG NINH
1522,CÔNG TY CỔ PHẦN BÊ TÔNG BIÊN HOÀ
1523,CÔNG TY CỔ PHẦN ĐẦU TƯ VÀ XÂY DỰNG XA LỘ HÀ NỘI
1524,CÔNG TY CỔ PHẦN CAO SU BÌNH DƯƠNG
1525,TỔNG CÔNG TY PHÁT TRIỂN HẠ TẦNG VÀ ĐẦU TƯ TÀI CHÍNH VIỆT NAM
1526,CÔNG TY CỔ PHẦN VINACONEX 21
1527,CÔNG TY CỔ PHẦN THỦY ĐIỆN ĐĂKR’TIH
1528,CÔNG TY CỔ PHẦN ĐẦU TƯ NHÂN PHÚC ĐỨC
1529,CÔNG TY CỔ PHẦN XÂY DỰNG SỐ 14
1530,CÔNG TY CỔ PHẦN XÂY DỰNG VÀ KHAI THÁC VẬT LIỆU XÂY DỰNG MIỀN TRUNG
1531,CÔNG TY CỔ PHẦN XÂY DỰNG & KINH DOANH NHÀ CỬU LONG
1532,CÔNG TY CỔ PHẦN XÂY DỰNG SỐ MỘT - VIỆT TỔNG
1533,CÔNG TY CỔ PHẦN CHƯƠNG DƯƠNG  
1534,CÔNG TY CỔ PHẦN SẢN XUẤT THÉP VIỆT ĐỨC
1535,CÔNG TY CỔ PHẦN TẬP ĐOÀN BGI
1536,CÔNG TY CỔ PHẦN ĐẦU TƯ VÀ XÂY DỰNG VINA2
1537,CÔNG TY CỔ PHẦN XÂY DỰNG SỐ 5
1538,CÔNG TY CỔ PHẦN XÂY DỰNG VÀ KINH DOANH VẬT TƯ 
1539,CÔNG TY CỔ PHẦN XÂY DỰNG MIỀN ĐÔNG
1540,CÔNG TY CỔ PHẦN XÂY DỰNG & SẢN XUẤT VẬT LIỆU XÂY DỰNG
1541,CÔNG TY CỔ PHẦN KHOÁNG SẢN TẤN PHÁT
1542,CÔNG TY CỔ PHẦN GANG THÉP CAO BẰNG
1543,CÔNG TY TNHH TƯ VẤN SÔNG ĐÀ - UCRIN
1544,CÔNG TY CỔ PHẦN ĐIỆN VIỆT - LÀO (HÀ NỘI)
1545,CÔNG TY CỔ PHẦN ĐẦU TƯ XÂY DỰNG VÀ PHÁT TRIỂN ĐÔ THỊ SÔNG ĐÀ
1546,CÔNG TY CỔ PHẦN SÔNG ĐÀ 11
1547,CÔNG TY CỔ PHẦN ĐẦU TƯ PHÁT TRIỂN ĐÔ THỊ VÀ KHU CÔNG NGHIỆP SÔNG ĐÀ
1548,CÔNG TY CỔ PHẦN B.O.O THỦ ĐỨC
1549,CÔNG TY CỔ PHẦN THỦY ĐIỆN SÔNG BA HẠ
1550,CÔNG TY CỔ PHẦN THỦY ĐIỆN MIỀN TRUNG
1551,CÔNG TY CỔ PHẦN CẤP NƯỚC GIA ĐỊNH
1552,CÔNG TY CỔ PHẦN CẤP NƯỚC NHÀ BÈ
1553,CÔNG TY CỔ PHẦN THỦY ĐIỆN VĨNH SƠN - SÔNG HINH
1554,CÔNG TY CỔ PHẦN ĐẦU TƯ VÀ KINH DOANH NƯỚC SẠCH SÀI GÒN (SWIC)
1555,CÔNG TY CỔ PHẦN THỦY ĐIỆN BÌNH ĐIỀN
1556,CÔNG TY CỔ PHẦN CƠ ĐIỆN ĐOÀN NHẤT
1557,CÔNG TY CỔ PHẦN THỦY ĐIỆN THÁC MƠ
1558,CÔNG TY CỔ PHẦN NHIỆT ĐIỆN PHẢ LẠI 
1559,CÔNG TY CỔ PHẦN THỦY ĐIỆN SROK PHU MIÊNG IDICO
1560,CÔNG TY CỔ PHẦN TỔNG CÔNG TY CỔ PHẦN ĐỊA ỐC SÀI GÒN
1561,CÔNG TY CỔ PHẦN NHIỆT ĐIỆN NINH BÌNH
1562,CÔNG TY TNHH XĂNG DẦU KIÊN GIANG
1563,CÔNG TY CỔ PHẦN THỰC PHẨM ĐÓNG HỘP KIÊN GIANG
1564,CÔNG TY CỔ PHẦN SÁCH - THIẾT BỊ TRƯỜNG HỌC KIÊN GIANG
1565,CÔNG TY CỔ PHẦN XUẤT NHẬP KHẨU Y TẾ VIỆT NAM
1566,CÔNG TY CỔ PHẦN DƯỢC PHẨM SANOFI - SYNTHELABO
1567,CÔNG TY CỔ PHẦN DƯỢC DANAPHA
1568,CÔNG TY CỔ PHẦN DƯỢC PHẨM TRUNG ƯƠNG 25
1569,CÔNG TY CỔ PHẦN DƯỢC DANAPHA - NANOSOME
1570,CÔNG TY CỔ PHẦN DƯỢC PHẨM TRUNG ƯƠNG 3
1571,CÔNG TY CỔ PHẦN DƯỢC PHẨM IMEXPHARM 
1572,CÔNG TY CỔ PHẦN SONADEZI CHÂU ĐỨC
1573,CÔNG TY CỔ PHẦN XÂY DỰNG ĐỒNG NAI
1574,CÔNG TY CỔ PHẦN ĐẦU TƯ QUỐC LỘ 91 CẦN THƠ - AN GIANG
1575,CÔNG TY CỔ PHẦN SONADEZI AN BÌNH
1576,CÔNG TY CỔ PHẦN BẾN XE VÀ DỊCH VỤ VẬN TẢI ĐỒNG NAI
1577,CÔNG TY CỔ PHẦN SƠN ĐỒNG NAI
1578,CÔNG TY CỔ PHẦN XÂY DỰNG CÔNG NGHIỆP SỐ 1 - ĐỒNG NAI
1579,CÔNG TY CỔ PHẦN THƯƠNG MẠI PHÁT TRIỂN SÀI GÒN 268
1580,CÔNG TY CỔ PHẦN NETNAM
1581,CÔNG TY CỔ PHẦN DỊCH VỤ SONADEZI
1582,CÔNG TY CỔ PHẦN ZA HƯNG
1583,CÔNG LY CỔ PHẦN NĂNG LƯỢNG AGRITA QUÀNG NAM
1584,CÔNG TY CỔ PHẦN THUỶ ĐIỆN SÔNG TRANH 4
1585,CÔNG TY CỔ PHẦN BẢO HIỂM LANEXANG
1586,CÔNG TY CỔ PHẦN BẤT ĐỘNG SẢN BƯU ĐIỆN (POSTRE)
1587,CÔNG TY CỔ PHẦN VIỄN THÔNG TIN HỌC ĐIỆN TỬ (KASATI)
1588,CÔNG TY CỔ PHẦN PHÁT TRIỂN ĐƯỜNG CAO TỐC BIÊN HÒA - VŨNG TÀU
1589,CÔNG TY CỔ PHẦN XÂY DỰNG SỐ 1 SÔNG HỒNG
1590,CÔNG TY CỔ PHẦN ĐẦU TƯ XÂY DỰNG LẮP MÁY IDICO
1591,CÔNG TY CỔ PHẦN BAO BÌ TIỀN PHONG
1592,CÔNG TY CỔ PHẦN NHỰA THIẾU NIÊN TIỀN PHONG PHÍA NAM
1593,CÔNG TY CỔ PHẦN ĐẦU TƯ XÂY DỰNG VINATEX
1594,CÔNG TY CỔ PHẦN KỸ THUẬT NAM CÔNG
1595,CÔNG TY CỔ PHẦN TẬP ĐOÀN PAN
1596,CÔNG TY CỔ PHẦN XÂY LẮP ĐIỆN BẮC THÁI
1597,QUỸ ĐẦU TƯ CHỨNG KHOÁN Y TẾ BẢN VIỆT (VCHF)
1598,CÔNG TY CỔ PHẦN SÀI GÒN-RẠCH GIÁ
1599,CÔNG TY TNHH PHÚC TIẾN HẢI PHÒNG
1600,CÔNG TY CỔ PHẦN DU LỊCH NBC CAM BÌNH RESORT
1601,CÔNG TY CỔ PHẦN MAY SÔNG TIỀN
1602,CÔNG TY CỔ PHẦN MAY NHÀ BÈ - SÓC TRĂNG
1603,CÔNG TY CỔ PHẦN XÂY LẮP CÔNG NGHIỆP NHÀ BÈ
1604,CÔNG TY CỔ PHẦN TƯ VẤN CÔNG NGHỆ NHÀ BÈ
1605,CÔNG TY CỔ PHẦN ĐẦU TƯ VÀ PHÁT TRIỂN DỊCH VỤ THƯƠNG MẠI NHÀ BÈ
1606,CÔNG TY CỔ PHẦN MAY 9 - NAM ĐỊNH
1607,CÔNG TY TNHH MAY VINATEX TƯ NGHĨA
1608,CÔNG TY CỔ PHẦN MAY PHÚ THỊNH - NHÀ BÈ
1609,CÔNG TY CỔ PHẦN ĐẦU TƯ SERENITY
1610,CÔNG TY CỔ PHẦN ĐẦU TƯ BẤT ĐỘNG SẢN BIDICI
1611,CÔNG TY TNHH ĐẦU TƯ XÂY DỰNG CÔNG TRÌNH PĐP
1612,CÔNG TY CỔ PHẦN NƯỚC SÀI GÒN - AN KHÊ
1613,CÔNG TY CỔ PHẦN LICOGI 166
1614,CÔNG TY CỔ PHẦN LICOGI 16.8
1615,CÔNG TY CỔ PHẦN ĐIỆN LỰC LICOGI 16
1616,CÔNG TY CỔ PHẦN CẤP NƯỚC KHU KINH TẾ ĐÔNG NAM QUẢNG TRỊ
1617,CÔNG TY CỔ PHẦN ĐẦU TƯ XÂY DỰNG CẤP THOÁT NƯỚC SƠN THẠNH
1618,CÔNG TY CỔ PHẦN CẤP NƯỚC CẦN THƠ 2
1619,CÔNG TY CỔ PHẦN CẤP THOÁT NƯỚC LONG AN
1620,CÔNG TY CỔ PHẦN CẤP THOÁT NƯỚC CẦN THƠ
1621,CÔNG TY CỔ PHẦN CẤP NƯỚC CÀ MAU
1622,CÔNG TY CỔ PHẦN BẮC GIANG LẠNG SƠN HỮU NGHỊ
1623,CÔNG TY TNHH NHIÊN LIỆU SINH HỌC PHƯƠNG ĐÔNG
1624,CÔNG TY CỔ PHẦN ĐẦU TƯ KHOÁNG SẢN QUẢNG NGÃI
1625,CÔNG TY CỔ PHẦN DU LỊCH GOLF VŨNG TÀU
1626,CÔNG TY CỔ PHẦN ĐẦU TƯ XÂY DỰNG THÀNH PHÚC
1627,CÔNG TY CỔ PHẦN HỢP TÁC KINH TẾ VÀ XUẤT NHẬP KHẨU SAVIMEX
1628,CÔNG TY CỔ PHẦN ĐẦU TƯ VÀ PHÁT TRIỂN HOÀNG AN
1629,CÔNG TY CỔ PHẦN DỆT MAY GIA ĐỊNH
1630,CÔNG TY CỔ PHẦN THỦY ĐIỆN YÊN BÌNH
1631,CÔNG TY CỔ PHẦN GẠCH MEN ANH EM DIC
1632,CÔNG TY CỔ PHẦN DIC TOÀN CẦU
1633,CÔNG TY CỔ PHẦN BẤT ĐỘNG SẢN DIC
1634,CÔNG TY CỔ PHẦN ĐẦU TƯ PHÁT TRIỂN XÂY DỰNG BÊ TÔNG
1635,CÔNG TY CỔ PHẦN XÂY DỰNG DIC HOLDINGS
1636,CÔNG TY CỔ PHẦN ĐẦU TƯ PHÁT TRIỂN - XÂY DỰNG SỐ 2
1637,CÔNG TY CỔ PHẦN ĐẦU TƯ -XÂY DỰNG CHÁNH PHÚ HÒA
1638,CÔNG TY CỔ PHẦN CẤP NƯỚC ĐỒNG NAI
1639,TỔNG CÔNG TY SẢN XUẤT - XUẤT NHẬP KHẨU BÌNH DƯƠNG - CÔNG TY CỔ PHẦN
1640,TỔNG CÔNG TY THƯƠNG MẠI XUẤT NHẬP KHẨU THANH LỄ - CÔNG TY CỔ PHẦN
1641,CÔNG TY CỔ PHẦN ĐẦU TƯ ĐẤT VIỄN ĐÔNG
1642,CÔNG TY LIÊN DOANH TNHH NIPPON EXPRESS VIỆT NAM
1643,CÔNG TY CỔ PHẦN XUẤT NHẬP KHẨU VÀ ĐẦU TƯ CHỢ LỚN (CHOLIMEX)
1644,CÔNG TY CỔ PHẦN VẬN TẢI VÀ XẾP DỠ HẢI AN
1645,CÔNG TY CỔ PHẦN CUNG ỨNG VÀ DỊCH VỤ KỸ THUẬT HÀNG HẢI
1646,CÔNG TY CỔ PHẦN NNR MIZUKI
1647,CÔNG TY TNHH ANABUKI NL HOUSING SERVICE VIỆT NAM
1648,CÔNG TY CỔ PHẦN VẬN TẢI XĂNG DẦU VIPCO
1649,CÔNG TY LIÊN DOANH TNHH KHO XĂNG DẦU NGOẠI QUAN VÂN PHONG
1650,CÔNG TY CỔ PHẦN XÂY LẮP PETROLIMEX 1
1651,TỔNG CÔNG TY TÁI BẢO HIỂM QUỐC GIA
1652,CÔNG TY CỔ PHẦN ĐẦU TƯ DỊCH VỤ VÀ HẠ TẦNG XĂNG DẦU (PLAND)
1653,CÔNG TY CỔ PHẦN THƯƠNG MẠI VÀ SỬA CHỮA ÔTÔ PETROLIMEX
1654,CÔNG TY CỔ PHẦN TÂN CẢNG GIAO LONG
1655,CÔNG TY TNHH THƯƠNG MẠI VINH QUANG
1656,CÔNG TY CỔ PHẦN SẢN XUẤT & KINH DOANH THƯƠNG MẠI THÀNH ĐẠT
1657,CÔNG TY TNHH ĐẦU TƯ & PHÁT TRIỂN TÂN ĐẠI PHÁT
1658,CÔNG TY TNHH KHÍ DẦU MỎ HÓA LỎNG BE TA GAS
1659,CÔNG TY TNHH BÌNH KHÍ ĐỐT HONGVINA
1660,CÔNG TY CỔ PHẦN KHU CÔNG NGHIỆP NAM TÂN UYÊN
1661,CÔNG TY CỔ PHẦN THỂ THAO NGÔI SAO GERU
1662,CÔNG TY TNHH B.O.T ĐT830
1663,CÔNG TY CỔ PHẦN NĂNG LƯỢNG BCG - BĂNG DƯƠNG
1664,CÔNG TY CỔ PHẦN ASSINO HIGHLAND AGRICULTURE
1665,GEMADEPT (MALAYSIA) LTD.
1666,CÔNG TY TNHH CJ GEMADEPT SHIPPING HOLDINGS
1667,CÔNG TY TNHH MỘT THÀNH VIÊN VẬN TẢI BIỂN GEMADEPT
1668,GEMADEPT SHIPPING SINGAPORE PTE. LTD.
1669,CÔNG TY CỔ PHẦN CẢNG CÁI MÉP GEMADEPT - TERMINAL LINK
1670,CÔNG TY TNHH TIẾP VẬN “K” LINE – GEMADEPT
1671,CÔNG TY TNHH CJ GEMADEPT LOGISTICS HOLDINGS
1672,CÔNG TY CỔ PHẦN DU LỊCH VÀ KHÁCH SẠN SUỐI MƠ
1673,CÔNG TY CỔ PHẦN XI MĂNG CẨM PHẢ
1674,CÔNG TY CỔ PHẦN ĐẦU TƯ PHÁT TRIỂN ĐIỆN MIỀN BẮC 2
1675,CÔNG TY TNHH THƯƠNG MẠI & DỊCH VỤ THIÊN QUÝ
1676,CÔNG TY CỔ PHẦN IN VÀ VĂN HÓA PHẨM
1677,CÔNG TY CỔ PHẦN KIMH DOANH ĐỊA ỐC VĂN PHÚ
1678,CÔNG TY CỔ PHẦN ĐẦU TƯ PHÁT TRIỂN THƯƠNG MẠI VĂN PHÚ
1679,CÔNG TY CỔ PHẦN ĐẦU TƯ BOT HÀ NỘI - BẮC GIANG
1680,CÔNG TY TNHH MỘT THÀNH VIÊN GEMADEPT HẢI PHÒNG
1681,CÔNG TY TNHH MỘT THÀNH VIÊN TIẾP VẬN GEMADEPT
1682,CÔNG TY TNHH OOCL LOGISTICS (VIỆT NAM)
1683,CÔNG TY TNHH THƯƠNG MẠI QUẢ CẦU VÀNG
1684,CÔNG TY CỔ PHẦN DU LỊCH MINH ĐẠM
1685,CÔNG TY TNHH GOLDEN GLOBE
1686,CÔNG TY CỔ PHẦN DỊCH VỤ HÀNG HÓA SÀI GÒN
1687,CÔNG TY CỔ PHẦN THƯƠNG CẢNG VŨNG TÀU
1688,CÔNG TY CỔ PHẦN LIÊN HIỆP THỰC PHẨM
1689,CÔNG TY CỔ PHẦN GẠCH MEN THANH THANH 
1690,CÔNG TY TNHH XÂY DỰNG FICO - COREA
1691,CÔNG TY CỔ PHẦN BÊ TÔNG FICO PAN-UNITED
1692,CÔNG TY CỔ PHẦN FICO CÔNG NGHỆ CAO
1693,CÔNG TY CỔ PHẦN VITALY
1694,CÔNG TY TNHH KHAI THÁC ĐÁ TÂN SƠN
1695,CÔNG TY CỔ PHẦN KHOÁNG SẢN FICO BÌNH PHƯỚC
1696,CÔNG TY TNHH ĐẦU TƯ XÂY DỰNG TÂN BÁCH VIỆT
1697,CÔNG TY CỔ PHẦN HÓA AN
1698,CÔNG TY TNHH CĂN HỘ VƯỜN PHỐ VIỆT NAM
1699,CÔNG TY CỔ PHẦN GẠCH NGÓI ĐỒNG NAI
1700,CÔNG TY CỔ PHẦN MEKONG LOGISTIC
1701,CÔNG TY CỔ PHẦN HAVALI FICO
1702,CÔNG TY CỔ PHẦN HÀ THÁI VINA THÁI BÌNH
1703,CÔNG TY CỔ PHẦN NĂNG LƯỢNG TÁI TẠO LICOGI 13
1704,CÔNG TY TNHH TRUNG CHÍNH
1705,CÔNG TY CỔ PHẦN CÔNG NGHỆ VÀ VẬT LIỆU CHUYÊN DỤNG LICOGI13
1706,CÔNG TY CỔ PHẦN TƯ VẤN AGI & GLC
1707,CÔNG TY CỔ PHẦN TƯ VẤN AGI & HVC
1708,CÔNG TY CỔ PHẦN TƯ VẤN AGI & DDC
1709,CÔNG TY TNHH DMC-VTS
1710,CÔNG TY CỔ PHẦN PT NHÀ PHONG PHÚ - DAEWON - THỦ ĐỨC
1711,CÔNG TY CỔ PHẦN MAY ĐÀ LẠT
1712,CÔNG TY CỔ PHẦN DỆT ĐÔNG NAM
1713,CÔNG TY TNHH COATS PHONG PHÚ
1714,CÔNG TY CỔ PHẦN XÚC TIẾN THƯƠNG MẠI VÀ ĐẦU TƯ PHONG PHÚ
1715,CÔNG TY CỔ PHẦN DỆT MAY NHA TRANG
1716,CÔNG TY CỔ PHẦN ĐẦU TƯ PHÁT TRIỂN NHÀ VÀ ĐÔ THỊ HUD SÀI GÒN
1717,CÔNG TY CỔ PHẦN ĐẦU TƯ VÀ PHÁT TRIỂN HẠ TẦNG AN VIỆT
1718,CÔNG TY CỔ PHẦN DỊCH VỤ DU LỊCH PHÚ THỌ
1719,CÔNG TY CỔ PHẦN CAPELLA VIỆT NAM
1720,CÔNG TY CỔ PHẦN ROSLAND
1721,CÔNG TY CỔ PHẦN ĐẦU TƯ ĐỊA ỐC KIM THÀNH
1722,CÔNG TY CỔ PHẦN ĐẦU TƯ SVG
1723,CÔNG TY CỔ PHẦN KHU CÔNG NGHIỆP THÀNH THÀNH CÔNG
1724,CÔNG TY CỔ PHẦN ĐẦU TƯ XÂY DỰNG IDICO - LONG AN
1725,CÔNG TY CỔ PHẦN BAO BÌ KHO BÃI BÌNH TÂY
1726,CÔNG TY CỔ PHẦN MAY TIẾN PHÁT
1727,CÔNG TY CỔ PHẦN TESTCO
1728,CÔNG TY CỔ PHẦN ĐTKD AN PHÚ HƯNG
1729,CÔNG TY CỔ PHẦN GREENPAN
1730,CÔNG TY CỔ PHẦN XÂY LẮP THỪA THIÊN HUẾ
1731,CÔNG TY CỔ PHẦN PHILIPS CARBON BLACK VIET NAM
1732,CÔNG TY CỔ PHẦN THUẬN ĐỨC ECO
1733,CÔNG TY CỔ PHẦN ĐẦU TƯ CÔNG NGHỆ BTL VIỆT NAM
1734,CÔNG TY CỔ PHẦN CAO SU BIDIPHAR
1735,CÔNG TY CỔ PHẦN VẬN CHUYỂN VINALINK
1736,CÔNG TY LIÊN DOANH FC (VIỆT NAM)
1737,CÔNG TY LIÊN DOANH LCM (VIỆT NAM)
1738,CÔNG TY CỔ PHẦN LOGISTICS KIM THÀNH
1739,CÔNG TY CỔ PHẦN GIAO NHẬN VẬN TẢI MIỀN TRUNG (VINATRANS ĐÀ NẴNG)
1740,CÔNG TY LIÊN DOANH RCL (VIETNAM)
1741,CÔNG TY TNHH VẬN TẢI VIỆT NHẬT KONOIKE VINA (JAPAN)
1742,CÔNG TY CỔ PHẦN DỊCH VỤ TỔNG HỢP HẢI AN
1743,CÔNG TY TNHH ĐẠI LÝ VÀ TIẾP VẬN HẢI AN
1744,CÔNG TY CỔ PHẦN GIAO NHẬN VẬN TẢI HẢI AN
1745,CÔNG TY CỔ PHẦN ĐẦU TƯ BOT HÀ NỘI - BẮC GIANG
1746,CÔNG TY TNHH PHÚ QUỐC – SASCO
1747,CÔNG TY CỔ PHẦN THƯƠNG MẠI XĂNG DẦU TÂN SƠN NHẤT
1748,CÔNG TY CỔ PHẦN NHÀ VIỆT (VIETHAUS)
1749,CÔNG TY CỔ PHẦN PHÁT TRIỂN VƯỜN XANH
1750,CÔNG TY CỔ PHẦN ĐẦU TƯ THƯƠNG MẠI BẦU TRỜI XANH
1751,CÔNG TY TNHH SASCO LAND
1752,CÔNG TY CỔ PHẦN PHÁT TRIỂN ĐÔ THỊ KIÊN GIANG
1753,CÔNG TY THƯƠNG MẠI DỊCH VỤ THỜI TRANG HÀ NỘI (HAFASCO)
1754,CÔNG TY CỔ PHẦN DỊCH VỤ XUẤT NHẬP KHẨU NÔNG SẢN HÀ NỘI
1755,CÔNG TY CỔ PHẦN SẢN XUẤT KINH DOANH GIA SÚC GIA CẦM
1756,CÔNG TY CỔ PHẦN KD XUẤT NHẬP KHẨU AN PHÚ HƯNG
1757,CÔNG TY CỔ PHẦN 4P
1758,CÔNG TY CỔ PHẦN ĐẦU TƯ VÀ THƯƠNG MẠI ĐIỆN QUANG
1759,CÔNG TY CỔ PHẦN MAY KLW VIỆT NAM
1760,CÔNG TY CỔ PHẦN PHÁT TRIỂN THƯƠNG MẠI VÀ DU LỊCH HÀ NỘI
1761,CÔNG TY CỔ PHẦN SIÊU THỊ VHSC (VIỆT NAM)
1762,CÔNG TY CỔ PHẦN ĐẦU TƯ PHÁT TRIỂN HẠ TẦNG THƯƠNG MẠI HÀ NỘI
1763,CÔNG TY CỔ PHẦN PHÁT TRIỂN THƯƠNG MẠI HÀ NỘI
1764,CÔNG TY CỔ PHẦN THƯƠNG MẠI - ĐẦU TƯ LONG BIÊN
1765,CÔNG TY CỔ PHẦN KHÁCH SẠN TRÀNG THI
1766,CÔNG TY TNHH CAO ỐC Á CHÂU
1767,CÔNG TY CỔ PHẦN THƯƠNG MẠI MIỀN NÚI PHÚ THỌ
1768,CÔNG TY CỔ PHẦN THÔNG TIN HAPRO
1769,CÔNG TY CỔ PHẦN DƯỢC OPC BẮC GIANG
1770,CÔNG TY CỔ PHẦN PHÂN PHỐI HAPRO
1771,CÔNG TY CỔ PHẦN LIÊN HỢP XUẤT NHẬP KHẨU VÀ ĐẦU TƯ HÀ NỘI
1772,CÔNG TY CỔ PHẦN NỘI THẤT SINH THÁI HAPRO
1773,CÔNG TY CỔ PHẦN ONG MẬT HÀ NỘI
1774,CÔNG TY CỔ PHẦN SẢN XUẤT CHẾ BIẾN XUẤT NHẬP KHẨU ĐIỀU HAPRO BÌNH PHƯỚC
1775,CÔNG TY CỔ PHẦN VANG THĂNG LONG
1776,CÔNG TY CỔ PHẦN CÔNG NGHỆ CAO LOTTE-HPT
1777,CÔNG TY CỔ PHẦN CÔNG NGHỆ SÀI GÒN - STG
1778,CÔNG TY CỔ PHẦN THIÊN VIỆT RESORT & SPA
1779,CÔNG TY CỔ PHẦN QUẢN LÝ KHÁCH SẠN CRYSTAL HOLIDAYS
1780,CÔNG TY CỔ PHẦN QUẢN LÝ DU THUYỀN QUỐC TẾ CRYSTAL HOLIDAYS
1781,CÔNG TY CỔ PHẦN ĐẦU TƯ XUÂN ĐÀI BAY
