,Chuẩn hoá tên
439,CÔNG TY CỔ PHẦN ĐẦU TƯ CẢNG CÁI LÂN
440,CÔNG TY CỔ PHẦN ĐẠI LÝ HÀNG HẢI VIỆT NAM  
441,VINFAST ENGINEERING AUSTRALIA PTY LTD
442,VINFAST GERMANY GMBH
443,CÔNG TY TNHH TRUNG TÂM TÀI CHÍNH VIỆT NAM BERJAYA
444,CÔNG TY CỔ PHẦN CAO SU QUASA GERUCO (LÀO)
445,CÔNG TY CỔ PHẦN CAO SU TÂN BIÊN
446,CÔNG TY CỔ PHẦN VẬN TẢI BIỂN VIỆT NAM
447,CÔNG TY CỔ PHẦN VẬN TẢI BIỂN VINASHIP
448,CÔNG TY CỔ PHẦN CẢNG NGHỆ TĨNH
449,CÔNG TY CỔ PHẦN TƯ VẤN VÀ XÂY DỰNG CÔNG TRÌNH HÀNG HẢI
450,CÔNG TY CỔ PHẦN CẢNG QUẢNG NINH
451,CÔNG TY CỔ PHẦN DỊCH VỤ VẬN TẢI VÀ THƯƠNG MẠI
452,CÔNG TY TNHH CẢNG QUỐC TẾ CÁI MÉP
453,CÔNG TY TNHH CẢNG QUỐC TẾ SP - PSA
454,CÔNG TY CỔ PHẦN HÀNG HẢI SÀI GÒN
455,CÔNG TY CỔ PHẦN TNHH MỘT THÀNH VIÊN MÁY XÂY DỰNG MATEC
456,CÔNG TY TNHH TƯ VẤN THIẾT KẾ HÒA BÌNH (HBA)
457,CÔNG TY TNHH SƠN HÒA BÌNH (HBP)
458,CÔNG TY CỔ PHẦN NHÀ HÒA BÌNH
459,CÔNG TY CỔ PHẦN KỸ THUẬT JESCO HÒA BÌNH
460,CÔNG TY CỔ PHẦN ĐẦU TƯ XÂY DỰNG HẠ TẦNG HÒA BÌNH (HBI)
461,CÔNG TY CỔ PHẦN VINFAST LEASING
462,"IOT & MOBILITY Y COMMERCE, S.L."
463,MUNDO READER S.L
464,CÔNG TY CỔ PHẦN DU LỊCH - THƯƠNG MẠI - KHÁCH SẠN HƯNG YÊN
465,CÔNG TY CỔ PHẦN CAO SU LAI CHÂU
466,CÔNG TY CỔ PHẦN PHÁT TRIỂN HÀNG HẢI
467,CÔNG TY CỔ PHẦN VINALINES LOGISTICS - VIỆT NAM 
468,CÔNG TY TNHH MỘT THÀNH VIÊN DỊCH VỤ HÀNG HẢI HẬU GIANG
469,CÔNG TY CỔ PHẦN CẢNG VINALINES ĐÌNH VŨ
470,CÔNG TY TNHH VẬN TẢI HÀNG CÔNG NGHỆ CAO
471,CÔNG TY TNHH MỘT THÀNH VIÊN VẬN TẢI BIỂN ĐÔNG (BISCO)
472,CÔNG TY LIÊN DOANH KHAI THÁC CONTAINER VIỆT NAM (VINABRIDGE)
473,CÔNG TY CỔ PHẦN CẢNG KHUYẾN LƯƠNG
474,CÔNG TY CỔ PHẦN VẬN TẢI BIỂN VÀ HỢP TÁC LAO ĐỘNG QUỐC TẾ
475,CÔNG TY LIÊN DOANH VẬN TẢI QUỐC TẾ VIỆT NHẬT
476,CÔNG TY LIÊN DOANH DỊCH VỤ CONTAINER QUỐC TẾ CSG - SSA
477,CÔNG TY TNHH MỘT THÀNH VIÊN ĐỊA ỐC NO VA
478,CÔNG TY TNHH NO VA LUCKY PALACE
479,CÔNG TY TNHH MỘT THÀNH VIÊN NOVALAND AGENT
480,LUARNA EDICIONES S.L.
481,"DEEP TECHNOLOGY & ENGINEERING SERVICES, S.L."
482,CÔNG TY CỔ PHẦN CAO SU DẦU TIẾNG - CAMPUCHIA
483,CÔNG TY CỔ PHẦN CAO SU BÀ RỊA
484,CÔNG TY TNHH BẤT ĐỘNG SẢN KHẢI HƯNG
485,CÔNG TY TNHH ĐẦU TƯ ĐỊA ỐC THÀNH NHƠN
486,CÔNG TY TNHH NOVA AN PHÚ
487,CÔNG TY CỔ PHẦN BẤT ĐỘNG SẢN THỊNH VƯỢNG
488,"CONTACÔNG TY SERVICES FOR SATISFACÔNG TYION, S.L."
489,EDUCACIÓN Y ROBÓTICA S.L.
490,CÔNG TY TNHH VKETI
491,CÔNG TY CỔ PHẦN THƯƠNG MẠI DỊCH VỤ VÀ DU LỊCH CAO SU
492,CÔNG TY TNHH BẤT ĐỘNG SẢN BÁCH HỢP
493,CÔNG TY CỔ PHẦN ĐỊA ỐC NOVA MỸ ĐÌNH
494,CÔNG TY TNHH BẤT ĐỘNG SẢN GIA PHÚ
495,CÔNG TY TNHH BẤT ĐỘNG SẢN GIA ĐỨC
496,CÔNG TY TNHH NOVA PROPERTY MANAGEMENT
497,CÔNG TY TNHH MỘT THÀNH VIÊN ỐNG THÉP NAM KIM
498,CÔNG TY TNHH MỘT THÀNH VIÊN ỐNG THÉP NAM KIM CHU LAI
499,3D PRINTING & PRINTERS
500,"BQ-MUNDO RADER, UNIPESSOAL LDA"
501,MUNDO READER FRANCE S.A.R.L
502,CÔNG TY CỔ PHẦN GỖ LỘC NINH
503,CÔNG TY CỔ PHẦN CAO SU SA THẦY
504,CÔNG TY TNHH ĐẦU TƯ VÀ BẤT ĐỘNG SẢN TƯỜNG MINH
505,CÔNG TY TNHH NOVA SASCO
506,CÔNG TY TNHH ĐẦU TƯ VÀ PHÁT TRIỂN PHƯỚC LONG
507,CÔNG TY TNHH ĐẦU TƯ ĐỊA ỐC NOVA SAIGON ROYAL
508,CÔNG TY TNHH NO VA THẢO ĐIỀN
509,CÔNG TY CỔ PHẦN NOVA NIPPON
510,CÔNG TY CỔ PHẦN DỊCH VỤ NHIÊN LIỆU HÀNG KHÔNG NỘI BÀI (NAFSC)
511,CÔNG TY TNHH DỊCH VỤ BẢO DƯỠNG MÁY BAY CẢNG HÀNG KHÔNG MIỀN NAM
512,MUNDO READER GMBH
513,MUNDO READER S.R.L.
514,CÔNG TY CỔ PHẦN CAO SU DẦU TIẾNG - KRATIE
515,CÔNG TY CỔ PHẦN VRG - PHÚ YÊN
516,CÔNG TY CỔ PHẦN NOVA HOSPITALITY
517,CÔNG TY CỔ PHẦN THƯƠNG MẠI ĐẦU TƯ BẤT ĐỘNG SẢN PHÚ TRÍ
518,CÔNG TY TNHH MỘT THÀNH VIÊN QUẢN LÝ NỢ VÀ KHAI THÁC TÀI SẢN NGÂN HÀNG THƯƠNG MẠI CỔ PHẦN BẮC Á
519,CÔNG TY TNHH KIỀU HỐI ĐÔNG Á
520,SMART EUROPEAN DEVICES LIMITED
521,CÔNG TY CỔ PHẦN ĐẦU TƯ PHÁT TRIỂN CAO SU NGHỆ AN
522,CÔNG TY TNHH BẤT ĐỘNG SẢN NOVA RIVERSIDE
523,CÔNG TY CỔ PHẦN NOVA RICHSTAR
524,CÔNG TY CỔ PHẦN ĐẦU TƯ VÀ THƯƠNG MẠI NHÀ RỒNG
525,CÔNG TY CỔ PHẦN KINH DOANH BẤT ĐỘNG SẢN THÁI BÌNH
526,CÔNG TY TNHH DẦU THỰC VẬT DABACO
527,CÔNG TY TNHH DABACO BÌNH PHƯỚC
528,CÔNG TY TNHH LỢN GIỐNG HẠT NHÂN DABACO
529,CÔNG TY TNHH MỘT THÀNH VIÊN LỢN GIỐNG LẠC VỆ
530,CÔNG TY TNHH ĐẦU TƯ VÀ PHÁT TRIỂN CHĂN NUÔI GIA CÔNG
531,CÔNG TY TNHH ĐẦU TƯ PHÁT TRIỂN CHĂN NUÔI LỢN DABACO
532,XIBANTRONICS TRADING COMPANY LTD.
533,FUNDACIÓN PARA LA EDUCACIÓN Y EL DESARROLLO TECNOLÓGICO
534,"INTELIGENCIA OPERACIONAL PARA LA INGENIERÍA, S.L."
535,CÔNG TY CỔ PHẦN CAO SU BẢO LÂM
536,CÔNG TY CỔ PHẦN CAO SU TÂN BIÊN - KAMPONGTHOM
537,CÔNG TY TNHH ĐẦU TƯ VÀ PHÁT TRIỂN BẤT ĐỘNG SẢN 350
538,CÔNG TY CỔ PHẦN BẤT ĐỘNG SẢN ĐỈNH PHÁT
539,CÔNG TY CỔ PHẦN NOVA PRINCESS RESIDENCE
540,CÔNG TY TNHH MERUFA - NOVA
541,CÔNG TY TNHH ĐẦU TƯ VÀ PHÁT TRIỂN BẤT ĐỘNG SẢN NOVA PHÚC NGUYÊN
542,CÔNG TY TNHH DABACO TUYÊN QUANG
543,CÔNG TY TNHH LỢN GIỐNG DABACO LƯƠNG TÀI
544,CÔNG TY TNHH LỢN GIỐNG DABACO HÀ TĨNH
545,CÔNG TY TNHH LỢN GIỐNG DABACO HẢI PHÒNG
546,CÔNG TY TNHH LỢN GIỐNG DABACO HÀ NAM
547,CÔNG TY TNHH LỢN GIỐNG DABACO PHÚ THỌ
548,CÔNG TY TNHH MỘT THÀNH VIÊN GÀ GIỐNG DABACO
549,CÔNG TY CỔ PHẦN QUẢN LÝ QUỸ PVI
550,CÔNG TY TNHH DỊCH VỤ VÀ KINH DOANH VINFAST
551,MARCHA TECHNOLOGY S.L.
552,CÔNG TY CỔ PHẦN CAO SU BÀ RỊA - KOMPONG THOM
553,CÔNG TY CỔ PHẦN KHU CÔNG NGHIỆP AN ĐIỀN
554,CÔNG TY CỔ PHẦN CAO ỐC PHƯƠNG ĐÔNG
555,CÔNG TY CỔ PHẦN ĐẦU TƯ NGỌC LINH HOA
556,CÔNG TY CỔ PHẦN ĐẦU TƯ BẤT ĐỘNG SẢN VƯƠNG GIA
557,CÔNG TY CỔ PHẦN ĐỊA ỐC NHẬT HOA
558,CÔNG TY TNHH MỘT THÀNH VIÊN THƯƠNG MẠI HIỆP QUANG
559,CÔNG TY TNHH DỊCH VỤ THƯƠNG MẠI BẮC NINH
560,CÔNG TY TNHH CHẾ BIẾN THỰC PHẨM DABACO
561,CÔNG TY TNHH NÔNG NGHIỆP CÔNG NGHỆ CAO DABACO
562,CÔNG TY TNHH ĐẦU TƯ XÂY DỰNG VÀ PHÁT TRIỂN HẠ TẦNG DABACO
563,CÔNG TY CỔ PHẦN THỂ THAO CAO SU PHÚ RIỀNG
564,CÔNG TY CỔ PHẦN CƠ KHÍ CAO SU
565,CÔNG TY CỔ PHẦN THE PRINCE RESIDENCE
566,CÔNG TY TNHH NOVA RIVERGATE
567,CÔNG TY CỔ PHẦN ĐỊA ỐC THÀNH NHƠN
568,CÔNG TY CỔ PHẦN SÀI GÒN GÔN
569,CÔNG TY TNHH ĐẦU TƯ VÀ PHÁT TRIỂN BẤT ĐỘNG SẢN CQ89
570,CÔNG TY CỔ PHẦN VRG - ĐAK NÔNG
571,CÔNG TY CỔ PHẦN CAO SU VIỆT LÀO
572,CÔNG TY CỔ PHẦN ĐẦU TƯ VÀ PHÁT TRIỂN QUỐC TẾ THẾ KỶ 21
573,CÔNG TY TNHH ĐẦU TƯ VÀ PHÁT TRIỂN BẤT ĐỘNG SẢN SUN CITY
574,CÔNG TY CỔ PHẦN NGÔI NHÀ MEGA
575,CÔNG TY TNHH MEGA TIE
576,CÔNG TY CỔ PHẦN PHÁT TRIỂN NHÀ Ở VÀ HẠ TẦNG SÀI GÒN
577,CÔNG TY CỔ PHẦN CAO SU ĐỒNG NAI - KRATIE
578,CÔNG TY CỔ PHẦN CAO SU DẦU TIẾNG LÀO CAI
579,CÔNG TY TNHH BẤT ĐỘNG SẢN PHÚC BÌNH
580,CÔNG TY CỔ PHẦN NOVA FESTIVAL
581,CÔNG TY TNHH NOVA NAM Á
582,CÔNG TY CỔ PHẦN ĐẦU TƯ ĐỊA ỐC NO VA
583,CÔNG TY CỔ PHẦN THỰC PHẨM PAN (PAN FOOD)
584,CÔNG TY CỔ PHẦN PHÂN PHỐI HÀNG TIÊU DÙNG PAN (PAN CG)
585,CÔNG TY CỔ PHẦN CHẾ BIẾN THỰC PHẨM PAN (PFM)
586,CÔNG TY CỔ PHẦN BIBICA
587,CÔNG TY CỔ PHẦN ĐẦU TƯ XÂY DỰNG CAO SU PHÚ THỊNH
588,CÔNG TY CỔ PHẦN GỖ MDF VRG QUẢNG TRỊ
589,CÔNG TY TNHH NOVA SAGEL
590,CÔNG TY CỔ PHẦN CẢNG PHÚ ĐỊNH
591,CÔNG TY CỔ PHẦN KHÁCH SẠN DU LỊCH THANH NIÊN VŨNG TÀU
592,CÔNG TY CỔ PHẦN PHÁT TRIỂN ĐÔ THỊ KỶ NGUYÊN
593,CÔNG TY TNHH ĐẦU TƯ VÀ PHÁT TRIỂN ĐỊA ỐC GIA HUY
594,CÔNG TY CỔ PHẦN ĐẦU TƯ BẤT ĐỘNG SẢN PHONG ĐIỀN
595,CÔNG TY CỔ PHẦN PAN FARM
596,CÔNG TY CỔ PHẦN CHẾ BIẾN HÀNG XUẤT KHẨU LONG AN
597,CÔNG TY CỔ PHẦN CÀ PHÊ GOLDEN BEANS (GOLDENS BEAN)
598,CÔNG TY CỔ PHẦN THỦY SẢN 584 NHA TRANG
599,CÔNG TY CỔ PHẦN XUẤT NHẬP KHẨU THỦY SẢN BẾN TRE
600,CÔNG TY CỔ PHẦN PAN-HULIC (PAN-HULIC)
601,CÔNG TY CỔ PHẦN THỰC PHẨM SAO TA 
602,CÔNG TY CỔ PHẦN TẬP ĐOÀN GIỐNG CÂY TRỒNG VIỆT NAM
603,CÔNG TY CỔ PHẦN CÔNG NGHIỆP VÀ XUẤT NHẬP KHẨU CAO SU
604,CÔNG TY CỔ PHẦN VRG BẢO LỘC
605,CÔNG TY CỔ PHẦN THỦY ĐIỆN VRG NGỌC LINH
606,CÔNG TY CỔ PHẦN NHỰA AN PHÁT XANH
607,CÔNG TY CỔ PHẦN NHỰA HÀ NỘI
608,CÔNG TY CỔ PHẦN AN TIẾN INDUSTRIES
609,CÔNG TY CỔ PHẦN THỦY ĐIỆN GERUCO SÔNG CÔN
610,CÔNG TY CỔ PHẦN XÂY DỰNG SỐ 4
611,CÔNG TY TNHH MỘT THÀNH VIÊN GIÁO DỤC LÝ THÁI TỔ
612,CÔNG TY TNHH BOHEMIA
613,CÔNG TY CỔ PHẦN BẤT ĐỘNG SẢN VINACONEX
614,CÔNG TY CỔ PHẦN BÁCH THIÊN LỘC
615,CÔNG TY CỔ PHẦN VINACONEX DUNG QUẤT
616,CÔNG TY CỔ PHẦN KHU CÔNG NGHIỆP LONG KHÁNH
617,CÔNG TY CỔ PHẦN KHU CÔNG NGHIỆP DẦU GIÂY
618,CÔNG TY CỔ PHẦN XÂY DỰNG SỐ 1
619,CÔNG TY CỔ PHẦN XÂY DỰNG SỐ 17
620,CÔNG TY CỔ PHẦN VINACONEX SÀI GÒN
621,CÔNG TY CỔ PHẦN XÂY DỰNG VINACONEX ĐÀ NẴNG
622,CÔNG TY CỔ PHẦN VINACONEX 25
623,CÔNG TY CỔ PHẦN VINACONEX 27
624,CÔNG TY CỔ PHẦN XÂY DỰNG VÀ XUẤT NHẬP KHẨU QUYẾT THẮNG
625,CÔNG TY CỔ PHẦN PHÂN VI SINH QUẢNG TRỊ
626,CÔNG TY CỔ PHẦN CAO SU PHÚ RIỀNG - KRATIE
627,CÔNG TY CỔ PHẦN PHÁT TRIỂN THƯƠNG MẠI VINACONEX
628,CÔNG TY CỔ PHẦN XÂY DỰNG VINACONEX SỐ 16
629,CÔNG TY CỔ PHẦN VIMECO
630,CÔNG TY CỔ PHẦN ĐẦU TƯ VÀ PHÁT TRIỂN DU LỊCH VINACONEX
631,CÔNG TY CỔ PHẦN VINACONSULT
632,CÔNG TY CỔ PHẦN ĐẦU TƯ XÂY DỰNG VÀ KINH DOANH NƯỚC SẠCH VIWACO
633,CÔNG TY CỔ PHẦN SIÊU THỊ VÀ XUẤT NHẬP KHẨU THƯƠNG MẠI VIỆT NAM
634,CÔNG TY CỔ PHẦN ĐẦU TƯ PHÁT TRIỂN ĐIỆN MIỀN BẮC 2
635,CÔNG TY TNHH VINCOM RETAIL MIỀN BẮC
636,CÔNG TY TNHH VINCOM RETAIL MIỀN NAM
637,CÔNG TY CỔ PHẦN ĐẦU TƯ VÀ PHÁT TRIỂN ĐÔ THỊ SUỐI HOA
638,CÔNG TY TNHH THƯƠNG MẠI VÀ DỊCH VỤ KIDO
639,CÔNG TY TNHH MỘT THÀNH VIÊN THỰC PHẨM KIDO
640,TỔNG CÔNG TY CÔNG NGHIỆP DẦU THỰC VẬT VIỆT NAM - CÔNG TY CỔ PHẦN
641,CÔNG TY DẦU ĂN GOLDEN HOPE NHÀ BÈ
642,CÔNG TY CỔ PHẦN THỰC PHẨM ĐÔNG LẠNH KIDO
643,CÔNG TY CỔ PHẦN DẦU THỰC VẬT TƯỜNG AN
644,CÔNG TY CỔ PHẦN BAO BÌ DẦU THỰC VẬT
645,CÔNG TY CỔ PHẦN CHẾ BIẾN GỖ CAO SU ĐỒNG NAI
646,CÔNG TY TNHH PHÁT TRIỂN CAO SU PHƯỚC HÒA KAMPONG THOM
647,CÔNG TY CỔ PHẦN NHÂN LỰC VÀ THƯƠNG MẠI VINACONEX
648,CÔNG TY CỔ PHẦN ĐẦU TƯ NƯỚC SẠCH SÔNG ĐÀ
649,CÔNG TY CỔ PHẦN CAO SU PHƯỚC HÒA
650,CÔNG TY TNHH CAO SU PHƯỚC HÒA ĐẮK LẮK
651,CÔNG TY TNHH CAO SU & LÂM NGHIỆP PHƯỚC HÒA - ĐẮK LẮK
652,CÔNG TY CỔ PHẦN TNHH MỘT THÀNH VIÊN THƯƠNG MẠI HABECO
653,CÔNG TY CỔ PHẦN BIA HÀ NỘI - QUẢNG TRI
654,CÔNG TY CỔ PHẦN ĐẦU TƯ PHÁT TRIỂN CÔNG NGHỆ BIA RƯỢU NƯỚC GIẢI KHÁT HÀ NỘI
655,CÔNG TY CỔ PHẦN BAO BÌ BIA RƯỢU NƯỚC GIẢI KHÁT
656,CÔNG TY CỔ PHẦN BIA HÀ NỘI - THÁI BÌNH
657,CÔNG TY CỔ PHẦN PHÂN BÓN VÀ HÓA CHẤT DẦU KHÍ MIỀN BẮC
658,CÔNG TY CỔ PHẦN PHÂN BÓN VÀ HÓA CHẤT DẦU KHÍ MIỀN TRUNG
659,CÔNG TY CỔ PHẦN PHÂN BÓN VÀ HÓA CHẤT DẦU KHÍ ĐÔNG NAM BỘ
660,CÔNG TY CỔ PHẦN PHÂN BÓN VÀ HÓA CHẤT DẦU KHÍ TÂY NAM BỘ
661,CÔNG TY CỔ PHẦN THỂ THAO NGÔI SAO GERU
662,CÔNG TY CỔ PHẦN BIA HÀ NỘI - HẢI PHÒNG
663,CÔNG TY CỔ PHẦN BIA HÀ NỘI - QUẢNG BÌNH
664,CÔNG TY CỔ PHẦN THƯƠNG MẠI BIA HÀ NỘI
665,CÔNG TY CỔ PHẦN BIA HÀ NỘI - THANH HÓA
666,CÔNG TY CỔ PHẦN BIA HÀ NỘI - HẢI DƯƠNG
667,CÔNG TY CỔ PHẦN RƯỢU VÀ NƯỚC GIẢI KHÁT HÀ NỘI
668,CÔNG TY CỔ PHẦN BIA HÀ NỘI - HỒNG HÀ
669,CÔNG TY CỔ PHẦN CAO SU ĐỒNG PHÚ KRATIE
670,CÔNG TY CỔ PHẦN BIA THƯƠNG MẠI HÀ NỘI - QUẢNG NINH
671,CÔNG TY CỔ PHẦN BIA HÀ NỘI - NGHỆ AN
672,CÔNG TY CỔ PHẦN BIA HÀ NỘI - NAM ĐỊNH
673,CÔNG TY CỔ PHẦN HABECO - HẢI PHÒNG
674,CÔNG TY CỔ PHẦN CƠ KHÍ VẬN TẢI CAO SU DẦU TIẾNG
675,CÔNG TY CỔ PHẦN GỖ DẦU TIẾNG
676,CÔNG TY TNHH BẢO VỆ THỰC VẬT AN GIANG - CAMPUCHIA
677,CÔNG TY TNHH MỘT THÀNH VIÊN LƯƠNG THỰC VĨNH BÌNH
678,CÔNG TY TNHH MỘT THÀNH VIÊN LƯƠNG THỰC THOẠI SƠN
679,CÔNG TY TNHH MỘT THÀNH VIÊN LƯƠNG THỰC TÂN HỒNG
680,CÔNG TY TNHH MỘT THÀNH VIÊN LƯƠNG THỰC VĨNH HƯNG
681,CÔNG TY TNHH MỘT THÀNH VIÊN LƯƠNG THỰC VĨNH LỘC
682,CÔNG TY TNHH MỘT THÀNH VIÊN LƯƠNG THỰC VĨNH AN
683,CÔNG TY TNHH MỘT THÀNH VIÊN PHÂN HỮU CƠ ÂN THỊNH ĐIỀN
684,CÔNG TY TNHH MỘT THÀNH VIÊN CÀ PHÊ HƯƠNG VỊ TRỜI
685,CÔNG TY TNHH NGHIÊN CỨU VÀ SẢN XUẤT GIỐNG ỨNG DỤNG CÔNG NGHỆ CAO HƯNG THỊNH
686,CÔNG TY TÂY NINH - SIÊM RIỆP PHÁT TRIỂN CAO SU
687,CÔNG TY CỔ PHẦN CAO SU TÂY NINH
688,CÔNG TY TNHH TRÍCH LY DẦU CÁM VĨNH HÒA
689,CÔNG TY CỔ PHẦN LỘC TRỜI - VIÊN THỊ
690,CÔNG TY CỔ PHẦN ĐỊA ỐC AN GIANG
691,CÔNG TY CỔ PHẦN VẬN TẢI DẦU KHÍ VŨNG TÀU (PV TRANS VŨNG TÀU)
692,CÔNG TY CỔ PHẦN VẬN TẢI XĂNG DẦU PHƯƠNG NAM
693,CÔNG TY CỔ PHẦN VẬN TẢI SẢN PHẨM KHÍ QUỐC TẾ
694,CÔNG TY CỔ PHẦN VẬN TẢI DẦU KHÍ THÁI BÌNH DƯƠNG
695,CÔNG TY CỔ PHẦN VẬN TẢI DẦU PHƯƠNG ĐÔNG VIỆT
696,CÔNG TY CỔ PHẦN VẬN TẢI NHẬT VIỆT
697,CÔNG TY CỔ PHẦN VẬN TẢI DẦU KHÍ QUẢNG NGÃI
698,CÔNG TY CỔ PHẦN VẬN TẢI DẦU KHÍ HÀ NỘI (PV TRANS HÀ NỘI)
699,CÔNG TY CỔ PHẦN VẬN TẢI DẦU KHÍ ĐÔNG DƯƠNG
700,CÔNG TY CỔ PHẦN CHẾ BIẾN GỖ THUẬN AN
701,CÔNG TY CỔ PHẦN TÍN NGHĨA LÀO
702,CÔNG TY TNHH ĐẦU TƯ KHU CÔNG NGHIÊP TÍN NGHĨA
703,CÔNG TY CỔ PHẦN LOGISTICS TÍN NGHĨA - ICD BIÊN HÒA
704,CÔNG TY CỔ PHẦN DỊCH VỤ BẢO VỆ CHUYÊN NGHIỆP TÍN NGHĨA
705,CÔNG TY CỔ PHẦN KHU CÔNG NGHIỆP TÍN NGHĨA - PHƯƠNG ĐÔNG
706,CÔNG TY CỔ PHẦN THƯƠNG MẠI VÀ XÂY DỰNG PHƯỚC TÂN
707,CÔNG TY CỔ PHẦN PHÁT TRIỂN DOANH NGHIỆP NHỎ VÀ VỪA NHẬT BẢN
708,CÔNG TY CỔ PHẦN XĂNG DẦU TÍN NGHĨA
709,CÔNG TY CỔ PHẦN CHẾ BIẾN XUẤT NHẬP KHẨU NÔNG SẢN ĐỒNG NAI
710,CÔNG TY CỔ PHẦN ĐẦU TƯ NHƠN TRẠCH
711,CÔNG TY CỔ PHẦN KHU CÔNG NGHIỆP TÂN BÌNH
712,CÔNG TY CỔ PHẦN CAO SU ĐỒNG PHÚ
713,CÔNG TY CỔ PHẦN ĐẦU TƯ TÍN NGHĨA Á CHÂU
714,CÔNG TY CỔ PHẦN PHÁT TRIỂN KHU CÔNG NGHIỆP TÍN NGHĨA
715,CÔNG TY CỔ PHẦN KHU CÔNG NGHIỆP CAO SU BÌNH LONG
716,CÔNG TY CỔ PHẦN AN TIẾN INDUSTRIES
717,CÔNG TY CỔ PHẦN KHU CÔNG NGHIỆP KỸ THUẬT CAO AN PHÁT 1
718,CÔNG TY CỔ PHẦN AN THÀNH BICSOL
719,CÔNG TY TNHH AN THÀNH BICSOL SINGAPORE PTE
720,CÔNG TY CỔ PHẦN NHỰA BAO BÌ AN VINH
721,CÔNG TY CỔ PHẦN LIÊN VẬN AN TÍN
722,CÔNG TY TNHH KHU CÔNG NGHIỆP KỸ THUẬT CAO AN PHÁT
723,CÔNG TY CỔ PHẦN CAO SU TRƯỜNG PHÁT
724,CÔNG TY CỔ PHẦN CAO SU HÒA BÌNH
725,CÔNG TY CỔ PHẦN ĐẦU TƯ XÂY DỰNG CẦU ĐỒNG NAI
726,CÔNG TY TNHH BÊ TÔNG ĐÚC SẴN VINA PSMC
727,CÔNG TY CỔ PHẦN XÂY DỰNG SỐ MỘT - VIỆT HƯNG
728,CÔNG TY CỔ PHẦN XÂY DỰNG SỐ MỘT - VIỆT QUANG
729,CÔNG TY CỔ PHẦN  XÂY DỰNG SỐ MỘT - VIỆT NGUYÊN
730,CÔNG TY CỔ PHẦN KINH DOANH BẤT ĐỘNG SẢN CAO SU DẦU TIẾNG
731,CÔNG TY CỔ PHẦN VRG - KHẢI HOÀN
732,CÔNG TY TNHH MỘT THÀNH VIÊN VĨNH HOÀN COLLAGEN
733,CÔNG TY TNHH MỘT THÀNH VIÊN THANH BÌNH ĐỒNG THÁP
734,CÔNG TY TNHH MỘT THÀNH VIÊN THỰC PHẨM VĨNH PHƯỚC
735,CÔNG TY TNHH LƯƠNG THỰC VĨNH HOÀN 2
736,CÔNG TY CỔ PHẦN XUẤT NHẬP KHẨU SA GIANG 
737,CÔNG TY TNHH MỘT THÀNH VIÊN VĨNH HOÀN 4
738,CÔNG TY CỔ PHẦN ĐẦU TƯ VÀ XÂY DỰNG CẦU ĐƯỜNG BÌNH TRIỆU
739,CÔNG TY CỔ PHẦN ĐẦU TƯ CAO ỐC VĂN PHÒNG ĐIỆN BIÊN PHỦ
740,CÔNG TY TNHH MỘT THÀNH VIÊN DỊCH VỤ HẠ TẦNG CII
741,CÔNG TY TNHH MỘT THÀNH VIÊN ĐẦU TƯ KINH DOANH ĐỊA ỐC LỮ GIA
742,CÔNG TY TNHH MỘT THÀNH VIÊN BẮC THỦ THIÊM
743,CÔNG TY CỔ PHẦN ĐẦU TƯ HẠ TẦNG KỸ THUẬT VINAPHIL
744,CÔNG TY TNHH ĐÔ THỊ XANH SÀI GÒN LONG KHÁNH
745,CÔNG TY CỔ PHẦN CHẾ BIẾN VÀ XUẤT NHẬP KHẨU GỖ TÂY NINH
746,CÔNG TY CỔ PHẦN CAO SU HÀNG GÒN
747,CÔNG TY CỔ PHẦN XÂY DỰNG HẠ TẦNG CII
748,CÔNG TY CỔ PHẦN ĐẦU TƯ CẦU ĐƯỜNG CII
749,CÔNG TY CỔ PHẦN HẠ TẦNG NƯỚC SÀI GÒN
750,CÔNG TY CỔ PHẦN ĐẦU TƯ NĂM BẢY BẢY
751,CÔNG TY CỔ PHẦN XUẤT KHẨU CAO SU VRG NHẬT BẢN
752,CÔNG TY CỔ PHẦN CAO SU ĐỒNG PHÚ - ĐAK NÔNG
753,CÔNG TY CỔ PHẦN BỆNH VIỆN ĐA KHOA QUỐC TẾ BECAMEX
754,CÔNG TY CỔ PHẦN PHÁT TRIỂN HẠ TẦNG KỸ THUẬT 
755,CÔNG TY CỔ PHẦN BỆNH VIỆN MỸ PHƯỚC
756,CÔNG TY CỔ PHẦN KINH DOANH VÀ PHÁT TRIỂN BÌNH DƯƠNG
757,CÔNG TY CỔ PHẦN XÂY DỰNG VÀ GIAO THÔNG BÌNH DƯƠNG
758,ĐẠI HỌC QUỐC TẾ MIỀN ĐÔNG
759,CÔNG TY CỔ PHẦN PHÁT TRIỂN ĐÔ THỊ
760,CÔNG TY CỔ PHẦN CAO SU DẦU TIẾNG VIỆT LÀO
761,CÔNG TY CỔ PHẦN PHÂN BÓN THƯƠNG MẠI PHÚ THỊNH
762,CÔNG TY CỔ PHẦN PHÁT TRIỂN GIÁO DỤC MIỀN ĐÔNG
763,CÔNG TY CỔ PHẦN PHÁT TRIỂN ĐÔ THỊ VÀ KHU CÔNG NGHIỆP VIỆT NAM-SINGAPORE (VSIP JSC)
764,CÔNG TY CỔ PHẦN CÔNG NGHỆ & TRUYỀN THÔNG VIỆT NAM (VNTT)
765,CÔNG TY CỔ PHẦN CẤP THOÁT NƯỚC - MÔI TRƯỜNG BÌNH DƯƠNG
766,CÔNG TY CỔ PHẦN SETIA-BECAMEX
767,CÔNG TY CỔ PHẦN BECAMEX BÌNH PHƯỚC
768,CÔNG TY CỔ PHẦN DƯỢC PHẨM SAVI
769,CÔNG TY CỔ PHẦN THÉP VIỆT ĐỨC
770,CÔNG TY CỔ PHẦN KHU CÔNG NGHIỆP BẮC ĐỒNG PHÚ
771,CÔNG TY TNHH SẢN XUẤT GỖ CAO SU KON TUM
772,CÔNG TY TNHH BECAMEX TOKYU
773,CÔNG TY CỔ PHẦN DƯỢC BECAMEX
774,CÔNG TY CỔ PHẦN PHÁT TRIỂN CÔNG NGHIỆP BW
775,CÔNG TY CỔ PHẦN BẢO HIỂM HÙNG VƯƠNG
776,CÔNG TY CỔ PHẦN ĐẦU TƯ VÀ XÂY DỰNG BÌNH DƯƠNG ACC
777,CÔNG TY TNHH MỘT THÀNH VIÊN XÂY LẮP ĐIỆN 1 – ĐẠI MỖ
778,CÔNG TY CỔ PHẦN CAO SU KỸ THUẬT ĐỒNG PHÚ
779,CÔNG TY CỔ PHẦN GỖ ĐỒNG PHÚ
780,CÔNG TY TNHH MỘT THÀNH VIÊN XÂY LẮP ĐIỆN 1 – MIỀN NAM
781,CÔNG TY TNHH MỘT THÀNH VIÊN XÂY LẮP ĐIỆN 1 – HOÀNG MAI
782,CÔNG TY CỔ PHẦN SÔNG ĐÀ 4
783,CÔNG TY CỔ PHẦN SÔNG ĐÀ 6
784,CÔNG TY CỔ PHẦN SÔNG ĐÀ 5
785,CÔNG TY CỔ PHẦN KHU CÔNG NGHIỆP NAM TÂN UYÊN
786,CÔNG TY TNHH MỘT THÀNH VIÊN XÂY LẮP ĐIỆN 1 – MỸ ĐÌNH
787,CÔNG TY TNHH MỘT THÀNH VIÊN XÂY LẮP ĐIỆN 1 – MIỀN BẮC
788,CÔNG TY CỔ PHẦN SÔNG ĐÀ 10
789,CÔNG TY CỔ PHẦN THỦY ĐIỆN NẬM CHIẾN (SƠN LA)
790,CÔNG TY CỔ PHẦN SÔNG ĐÀ 9
791,CÔNG TY TNHH MỘT THÀNH VIÊN HẠ TẦNG SÔNG ĐÀ
792,CÔNG TY CỔ PHẦN TƯ VẤN SÔNG ĐÀ
793,CÔNG TY CỔ PHẦN SÔNG ĐÀ 3
794,CÔNG TY TNHH QUẢN LÝ NỢ VÀ KHAI THÁC TÀI SẢN NAM VIỆT NGÂN HÀNG
795,CÔNG TY CỔ PHẦN PHÁT TRIỂN ĐÔ THỊ VÀ KHU CÔNG NGHIỆP CAO SU VIỆT NAM
796,CÔNG TY TNHH MỘT THÀNH VIÊN XÂY LẮP ĐIỆN 1 – TỪ LIÊM
797,CÔNG TY TNHH MỘT THÀNH VIÊN XÂY LẮP ĐIỆN 1 – HÀ ĐÔNG
798,CÔNG TY TNHH MỘT THÀNH VIÊN XÂY LẮP ĐIỆN 1 – HÀ NỘI
799,CÔNG TY TNHH MỘT THÀNH VIÊN XÂY LẮP ĐIỆN 1 – NÀNG HƯƠNG
800,CÔNG TY TNHH MỘT THÀNH VIÊN XÂY LẮP ĐIỆN 1 - NINH BÌNH
801,CÔNG TY CỔ PHẦN THỦY ĐIỆN TRUNG THU
802,CÔNG TY CỔ PHẦN THƯƠNG MẠI ĐẦU TƯ TIẾN BỘ
803,CÔNG TY CỔ PHẦN PCCC & ĐTXÂY DỰNG SÔNG ĐÀ (HÀ NỘI)
804,CÔNG TY CỔ PHẦN ĐẦU TƯ PHÁT TRIỂN ĐIỆN SÊ SAN 3A (GIA LAI)
805,CÔNG TY CỔ PHẦN THỦY ĐIỆN CẦN ĐƠN
806,CÔNG TY CỔ PHẦN SÔNG ĐÀ 12
807,CÔNG TY CỔ PHẦN SÔNG ĐÀ 2
808,CÔNG TY CỔ PHẦN CƠ KHÍ - LẮP MÁY SÔNG ĐÀ
809,CÔNG TY CỔ PHẦN PHÁT TRIỂN NHÀ KHÁNH HÒA
810,CÔNG TY CỔ PHẦN ĐẦU TƯ ĐỊA ỐC MỸ ĐÌNH
811,CÔNG TY CỔ PHẦN CƠ KHÍ Ô TÔ HÒA BÌNH
812,CÔNG TY CỔ PHẦN THỦY ĐIỆN BẢO LÂM
813,CÔNG TY CỔ PHẦN ĐẦU TƯ NĂNG LƯỢNG MIỀN BẮC
814,CÔNG TY TNHH CHẾ TẠO CỘT THÉP ĐÔNG ANH
815,CÔNG TY CỔ PHẦN LẮP MÁY CÔNG NGHIỆP VIỆT NAM
816,CÔNG TY TNHH MỘT THÀNH VIÊN QUẢN LÝ NỢ VÀ KHAI THÁC TÀI SẢN-NGÂN HÀNG THƯƠNG MẠI CỔ PHẦN VIỆT NAM THƯƠNG TÍN (VIETBANKAMC)
817,CÔNG TY TNHH THƯƠNG MẠI DỊCH VỤ XÂY DỰNG TÍN HIỆU XANH
818,CÔNG TY TNHH QUẢN LÝ & KHAI THÁC BẤT ĐỘNG SẢN REE
819,CÔNG TY CỔ PHẦN ĐIỆN MÁY R.E.E
820,CÔNG TY CỔ PHẦN DỊCH VỤ & KỸ THUẬT CƠ ĐIỆN LẠNH R.E.E (REE ME)
821,CÔNG TY TNHH THƯƠNG MẠI & DỊCH VỤ RMC
822,EASTRADE INTERNATIONAL LTD
823,CÔNG TY CỔ PHẦN BẤT ĐỘNG SẢN R.E.E
824,CÔNG TY CỔ PHẦN ĐẦU TƯ VÀ KINH DOANH NƯỚC SẠCH VIỆT NAM
825,CÔNG TY CỔ PHẦN BẤT ĐỘNG SẢN SONG MAI
826,CÔNG TY CỔ PHẦN VĨNH THỊNH
827,CÔNG TY CỔ PHẦN HẠ TẦNG VÀ BẤT ĐỘNG SẢN VIỆT NAM
828,CÔNG TY CỔ PHẦN PHÁT TRIỂN ĐIỆN NÔNG THÔN TRÀ VINH
829,CÔNG TY CỔ PHẦN THỦY ĐIỆN THÁC BÀ
830,CÔNG TY CỔ PHẦN CẤP NƯỚC THỦ ĐỨC
831,CÔNG TY CỔ PHẦN Ô TÔ PHÚ MỸ
832,CÔNG TY CỔ PHẦN AUTO TRƯỜNG CHINH
833,CÔNG TY CỔ PHẦN CITY AUTO VŨNG TÀU
834,CÔNG TY CỔ PHẦN Ô TÔ NHA TRANG
835,CÔNG TY CỔ PHẦN THƯƠNG MẠI DỊCH VỤ KIÊN GIANG
836,CÔNG TY CỔ PHẦN DƯỢC PHẨM TRUNG ƯƠNG CODUPHA
837,CÔNG TY CỔ PHẦN DƯỢC PHẨM TRUNG ƯƠNG CỔ PHẦNCI
838,CÔNG TY CỔ PHẦN DƯỢC TRUNG ƯƠNG 3
839,CÔNG TY TNHH MỘT THÀNH VIÊN SƠN HÀ SSP VIỆT NAM
840,CÔNG TY TNHH MỘT THÀNH VIÊN SƠN HÀ NGHỆ AN
841,CÔNG TY TNHH MỘT THÀNH VIÊN THIẾT BỊ GIA DỤNG  SƠN HÀ BẮC NINH
842,CÔNG TY TNHH MỘT THÀNH VIÊN KINH DOANH VÀ PHÁT TRIỂN DỊCH VỤ SƠN HÀ MIỀN BẮC
843,CÔNG TYY TNHH MỘT THÀNH VIÊN TOÀN MỸ MIỀN TRUNG
844,CÔNG TY TNHH QUẢN LÝ VẬN HÀNH VÀ KINH DOANH NƯỚC SẠCH  SƠN HÀ
845,CÔNG TY TNHH MỘT THÀNH VIÊN THIẾT BỊ NHÀ BẾP SƠN HÀ
846,CÔNG TY CỔ PHẦN ĐIỆN MẶT TRỜI SƠN HÀ FREE SOLAR
847,CÔNG TY CỔ PHẦN TỔNG CÔNG TY TOÀN MỸ (THƯƠNG MẠIY)
848,CÔNG TY CỔ PHẦN KINH DOANH VÀ PHÁT TRIỂN DỰ ÁN SƠN HÀ
849,CÔNG TY CỔ PHẦN CÔNG NGHỆ XỬ LÝ NƯỚC VÀ MÔI TRƯỜNG SƠN HÀ
850,CÔNG TY CỔ PHẦN SẢN XUẤT VÀ DỊCH VỤ SƠN HÀ
851,CÔNG TY CỔ PHẦN CẤP THOÁT NƯỚC LẠNG SƠN
852,CÔNG TY CỔ PHẦN PHÁT TRIỂN NĂNG LƯỢNG SƠN HÀ
853,SONHA MYANMAR INTERNATIONAL LIMITED
854,CÔNG TY TNHH MỘT THÀNH VIÊN TOYOTA ĐÀ NẴNG
855,CÔNG TY TNHH MỘT THÀNH VIÊN TOYOTA BÌNH ĐỊNH
856,CÔNG TY TNHH MỘT THÀNH VIÊN BẤT ĐỘNG SẢN PHÚ TÀI
857,CÔNG TY TNHH ĐÁ GRANITE THÀNH CHÂU PHÚ YÊN
858,CÔNG TY TNHH MỘT THÀNH VIÊN TUẤN ĐẠT
859,CÔNG TY TNHH MỘT THÀNH VIÊN PHÚ TÀI ĐỒNG NAI
860,CÔNG TY CỔ PHẦN SẢN XUẤT THƯƠNG MẠI VÀ DỊCH VỤ Ô TÔ PTHƯƠNG MẠI
861,CÔNG TY CỔ PHẦN CƠ KHÍ Ô TÔ CẦN THƠ
862,CÔNG TY CỔ PHẦN MÔI TRƯỜNG SONADEZI
863,CÔNG TY CỔ PHẦN CẤP NƯỚC ĐỒNG NAI
864,CÔNG TY CỔ PHẦN ĐẦU TƯ XÂY DỰNG VÀ VẬT LIỆU ĐỒNG NAI
865,CÔNG TY CỔ PHẦN SONADEZI LONG THÀNH
866,CÔNG TY CỔ PHẦN SONADEZI GIANG ĐIỀN
867,CÔNG TY CỔ PHẦN CẢNG ĐỒNG NAI
868,CÔNG TY CỔ PHẦN PHÁT TRIỂN ĐÔ THỊ CÔNG NGHIỆP SỐ 2
869,CÔNG TY CỔ  PHẦN  HANSSEM
870,CÔNG TY CỔ PHẦN VINA G7
871,CÔNG TY SẢN XUẤT ĐÁ GRANIT TNHH
872,CÔNG TY CỔ PHẦN ĐÁ UNIVERSAL
873,CÔNG TY CỔ PHẦN VẬT LIỆU XÂY DỰNG PHÚ YÊN
874,CÔNG TY CỔ PHẦN PHÁT TRIỂN KINH DOANH THƯƠNG MẠI SÀI GÒN 168
875,CÔNG TY CỔ PHẦN ĐẦU TƯ GIÁO DỤC THIÊN NAM
876,CÔNG TY TNHH CÔNG NGHỆ PHẨM THIÊN NAM
877,CÔNG TY ĐẦU TƯ QUỐC TẾ HÀ ĐÔ
878,CÔNG TY TNHH MỘT THÀNH VIÊN QUẢN LÝ- VẬN HÀNH- KHAI THÁC BẤT ĐỘNG SẢN HÀ ĐÔ
879,CÔNG TY CỔ PHẦN ĐẦU TƯ BẤT ĐỘNG SẢN BÌNH AN RIVERSIDE
880,CÔNG TY CỔ PHẦN HÀ ĐÔ BÌNH THUẬN
881,CÔNG TY CỔ PHẦN HÀ ĐÔ NINH THUẬN
882,CÔNG TY CỔ PHẦN ĐẦU TƯ KHÁNH HÀ
883,CÔNG TY CỔ PHẦN IBS VIỆT NAM
884,CÔNG TY CỔ PHẦN THƯƠNG MẠI XĂNG DẦU VIỆT NAM (VINAPETRO)
885,CÔNG TY CỔ PHẦN HÀ ĐÔ - 756 SÀI GÒN
886,CÔNG TY TNHH HỖN HỢP DỊCH VỌNG
887,CÔNG TY CỔ PHẦN THIẾT BỊ GIÁO DỤC 1
888,CÔNG TY TNHH MỘT THÀNH VIÊN PHÁT TRIỂN ĐÔ THỊ VÀ KHU CÔNG NGHIỆP IDICO
889,CÔNG TY TNHH MỘT THÀNH VIÊN XÂY DỰNG IDICO
890,CÔNG TY CỔ PHẦN ĐẦU TƯ XÂY DỰNG SỐ 10 IDICO
891,CÔNG TY CỔ PHẦN ĐẦU TƯ XÂY DỰNG THÁI BÌNH IDICO
892,CÔNG TY CỔ PHẦN ĐẦU TƯ XÂY DỰNG VÀ PHÁT TRIỂN VẬT LIỆU IDICO 
